[
  {
    "record_id": "rec_001",
    "kind": "problem",
    "plants": [],
    "plant_groups": [
      "houseplant"
    ],
    "plant_parts": [
      "leaf"
    ],
    "symptoms": [
      "stunted_growth",
      "curling",
      "distorted_growth",
      "visible_insects"
    ],
    "symptoms_stated": true,
    "location_patterns": [],
    "cause": "Aphids",
    "cause_category": "pest",
    "summary": "Tiny green, brown or black insects sit on the undersides of leaves; growth is stunted and leaves curl or distort.",
    "distinguishing_questions": [
      {
        "question": "Are there tiny green, brown or black insects on the undersides of leaves?",
        "basis": "page"
      }
    ],
    "next_actions": [],
    "inspect_next": [
      {
        "item": "Look closely at the undersides of leaves",
        "basis": "page"
      }
    ],
    "caveats": "",
    "unsure": false,
    "review_notes": "Page gives no management for this pest.",
    "source_id": "src_psu_houseplant_problems",
    "source_url": "https://oc4h.ucanr.edu/sites/default/files/2020-07/330401.pdf",
    "status": "draft"
  },
  {
    "record_id": "rec_002",
    "kind": "problem",
    "plants": [],
    "plant_groups": [
      "houseplant"
    ],
    "plant_parts": [
      "leaf",
      "stem"
    ],
    "symptoms": [
      "visible_insects",
      "stunted_growth"
    ],
    "symptoms_stated": true,
    "location_patterns": [],
    "cause": "Mealybugs",
    "cause_category": "pest",
    "summary": "White, cottony-looking scale insects on stems and the undersides of leaves; plant growth is stunted.",
    "distinguishing_questions": [
      {
        "question": "Do you see white cottony bits on the stems or under the leaves?",
        "basis": "page"
      }
    ],
    "next_actions": [],
    "inspect_next": [
      {
        "item": "Check stems and the undersides of leaves",
        "basis": "page"
      }
    ],
    "caveats": "",
    "unsure": false,
    "review_notes": "Page gives no management for this pest.",
    "source_id": "src_psu_houseplant_problems",
    "source_url": "https://oc4h.ucanr.edu/sites/default/files/2020-07/330401.pdf",
    "status": "draft"
  },
  {
    "record_id": "rec_003",
    "kind": "problem",
    "plants": [],
    "plant_groups": [
      "houseplant"
    ],
    "plant_parts": [
      "leaf"
    ],
    "symptoms": [
      "webbing",
      "yellowing",
      "distorted_growth"
    ],
    "symptoms_stated": true,
    "location_patterns": [],
    "cause": "Mites",
    "cause_category": "pest",
    "summary": "Tiny light-colored arachnids; fine webbing appears on foliage and leaves become distorted and yellowish.",
    "distinguishing_questions": [
      {
        "question": "Is there fine webbing on the leaves?",
        "basis": "page"
      }
    ],
    "next_actions": [],
    "inspect_next": [],
    "caveats": "",
    "unsure": false,
    "review_notes": "Page gives no management for this pest.",
    "source_id": "src_psu_houseplant_problems",
    "source_url": "https://oc4h.ucanr.edu/sites/default/files/2020-07/330401.pdf",
    "status": "draft"
  },
  {
    "record_id": "rec_004",
    "kind": "problem",
    "plants": [],
    "plant_groups": [
      "houseplant"
    ],
    "plant_parts": [
      "leaf",
      "stem"
    ],
    "symptoms": [
      "visible_insects",
      "stunted_growth"
    ],
    "symptoms_stated": true,
    "location_patterns": [],
    "cause": "Scale insects",
    "cause_category": "pest",
    "summary": "Oval or round brown insects on stems and leaves; they suck plant juices, which leads to poor, stunted growth.",
    "distinguishing_questions": [
      {
        "question": "Are there small oval or round brown bumps on the stems or leaves?",
        "basis": "page"
      }
    ],
    "next_actions": [],
    "inspect_next": [],
    "caveats": "",
    "unsure": false,
    "review_notes": "Page gives no management for this pest.",
    "source_id": "src_psu_houseplant_problems",
    "source_url": "https://oc4h.ucanr.edu/sites/default/files/2020-07/330401.pdf",
    "status": "draft"
  },
  {
    "record_id": "rec_005",
    "kind": "problem",
    "plants": [],
    "plant_groups": [
      "houseplant"
    ],
    "plant_parts": [
      "leaf",
      "flower"
    ],
    "symptoms": [
      "distorted_growth",
      "faded_color"
    ],
    "symptoms_stated": true,
    "location_patterns": [],
    "cause": "Thrips",
    "cause_category": "pest",
    "summary": "Extremely tiny insects (adults light tan to dark brown); leaves and flowers become distorted and discolored.",
    "distinguishing_questions": [],
    "next_actions": [],
    "inspect_next": [],
    "caveats": "",
    "unsure": false,
    "review_notes": "Page gives no management for this pest. Insects are too small to see easily in a photo.",
    "source_id": "src_psu_houseplant_problems",
    "source_url": "https://oc4h.ucanr.edu/sites/default/files/2020-07/330401.pdf",
    "status": "draft"
  },
  {
    "record_id": "rec_006",
    "kind": "problem",
    "plants": [],
    "plant_groups": [
      "houseplant"
    ],
    "plant_parts": [
      "leaf"
    ],
    "symptoms": [
      "yellowing",
      "faded_color",
      "visible_insects"
    ],
    "symptoms_stated": true,
    "location_patterns": [],
    "cause": "Whiteflies",
    "cause_category": "pest",
    "summary": "Small white, gnat-like insects; leaves turn pale yellow or white.",
    "distinguishing_questions": [
      {
        "question": "Do small white flying insects rise when you touch the plant?",
        "basis": "derived_from_cause"
      }
    ],
    "next_actions": [],
    "inspect_next": [],
    "caveats": "",
    "unsure": false,
    "review_notes": "Page gives no management. The question is derived from the 'gnat-like' description.",
    "source_id": "src_psu_houseplant_problems",
    "source_url": "https://oc4h.ucanr.edu/sites/default/files/2020-07/330401.pdf",
    "status": "draft"
  },
  {
    "record_id": "rec_007",
    "kind": "problem",
    "plants": [],
    "plant_groups": [
      "houseplant"
    ],
    "plant_parts": [
      "leaf"
    ],
    "symptoms": [
      "yellowing",
      "brown_tips_edges"
    ],
    "symptoms_stated": true,
    "location_patterns": [],
    "cause": "Anthracnose (fungal)",
    "cause_category": "disease",
    "summary": "Leaf tips turn yellow and then brown, and the whole leaf may die.",
    "distinguishing_questions": [],
    "next_actions": [
      "Remove infected leaves",
      "Avoid misting"
    ],
    "inspect_next": [],
    "caveats": "",
    "unsure": false,
    "review_notes": "",
    "source_id": "src_psu_houseplant_problems",
    "source_url": "https://oc4h.ucanr.edu/sites/default/files/2020-07/330401.pdf",
    "status": "draft"
  },
  {
    "record_id": "rec_008",
    "kind": "problem",
    "plants": [],
    "plant_groups": [
      "houseplant"
    ],
    "plant_parts": [
      "leaf"
    ],
    "symptoms": [
      "brown_spots"
    ],
    "symptoms_stated": true,
    "location_patterns": [],
    "cause": "Leaf spot diseases (fungal or bacterial)",
    "cause_category": "disease",
    "summary": "Fungal spots are brown with a yellow halo; bacterial spots look water-soaked with a yellow halo. Fungal structures may be visible under magnification.",
    "distinguishing_questions": [
      {
        "question": "Are the spots brown with a yellow ring, or do they look water-soaked?",
        "basis": "page"
      }
    ],
    "next_actions": [
      "Remove infected leaves",
      "Increase air circulation",
      "Avoid wetting the leaves"
    ],
    "inspect_next": [
      {
        "item": "Look at the spots with a magnifier for tiny fungal structures",
        "basis": "page"
      }
    ],
    "caveats": "",
    "unsure": false,
    "review_notes": "",
    "source_id": "src_psu_houseplant_problems",
    "source_url": "https://oc4h.ucanr.edu/sites/default/files/2020-07/330401.pdf",
    "status": "draft"
  },
  {
    "record_id": "rec_009",
    "kind": "problem",
    "plants": [],
    "plant_groups": [
      "houseplant"
    ],
    "plant_parts": [
      "leaf"
    ],
    "symptoms": [
      "white_powdery_coating",
      "distorted_growth",
      "leaf_drop"
    ],
    "symptoms_stated": true,
    "location_patterns": [],
    "cause": "Powdery mildew (fungal)",
    "cause_category": "disease",
    "summary": "White powdery growth on foliage, with distorted leaves and possible leaf drop.",
    "distinguishing_questions": [],
    "next_actions": [
      "Increase air circulation",
      "Avoid saturated soil",
      "Remove severely infected foliage"
    ],
    "inspect_next": [],
    "caveats": "",
    "unsure": false,
    "review_notes": "",
    "source_id": "src_psu_houseplant_problems",
    "source_url": "https://oc4h.ucanr.edu/sites/default/files/2020-07/330401.pdf",
    "status": "draft"
  },
  {
    "record_id": "rec_010",
    "kind": "problem",
    "plants": [],
    "plant_groups": [
      "houseplant"
    ],
    "plant_parts": [
      "roots",
      "stem"
    ],
    "symptoms": [
      "soft_mushy_stem",
      "wilting_drooping"
    ],
    "symptoms_stated": true,
    "location_patterns": [],
    "cause": "Root and stem rots",
    "cause_category": "disease",
    "summary": "Roots turn soft and brown or black; stems go soft with a brown or black ring near the soil line; the plant wilts and can die.",
    "distinguishing_questions": [
      {
        "question": "Is the stem soft or dark near the soil line, or are the roots soft and brown/black?",
        "basis": "page"
      }
    ],
    "next_actions": [
      "Avoid overwatering",
      "Remove infected plants",
      "If only partly infected, cut off infected roots and repot in sterile mix and a clean pot"
    ],
    "inspect_next": [
      {
        "item": "Check the roots and the stem near the soil line",
        "basis": "page"
      }
    ],
    "caveats": "",
    "unsure": false,
    "review_notes": "",